{
  "$schema": "https://json-schema.org/draft/2020-12/schema",
  "$id": "urn:beacn:implementation-register:v1",
  "title": "BEACN implementation evidence register v1",
  "type": "object",
  "additionalProperties": false,
  "required": [
    "schemaVersion",
    "kind",
    "asOf",
    "repository",
    "sourceCatalog",
    "description",
    "records"
  ],
  "properties": {
    "schemaVersion": {
      "const": 1
    },
    "kind": {
      "const": "beacn.implementation-register"
    },
    "asOf": {
      "type": "string",
      "minLength": 1,
      "maxLength": 24,
      "pattern": "^\\d{4}-\\d{2}-\\d{2}T\\d{2}:\\d{2}:\\d{2}\\.\\d{3}Z$",
      "format": "date-time"
    },
    "repository": {
      "const": "https://github.com/BEACNpool/NFT-Studio"
    },
    "sourceCatalog": {
      "type": "object",
      "additionalProperties": false,
      "required": [
        "path",
        "sha256"
      ],
      "properties": {
        "path": {
          "const": "knowledge/catalog.json"
        },
        "sha256": {
          "type": "string",
          "minLength": 1,
          "maxLength": 64,
          "pattern": "^[a-f0-9]{64}$"
        }
      }
    },
    "description": {
      "type": "string",
      "minLength": 1,
      "maxLength": 1200
    },
    "records": {
      "type": "array",
      "minItems": 1,
      "maxItems": 5,
      "items": {
        "type": "object",
        "additionalProperties": false,
        "required": [
          "id",
          "entryIds",
          "title",
          "publication",
          "summary",
          "capabilities",
          "evidence",
          "limits",
          "nextEvidence"
        ],
        "properties": {
          "id": {
            "type": "string",
            "minLength": 1,
            "maxLength": 80,
            "pattern": "^[a-z][a-z0-9-]{0,79}$"
          },
          "entryIds": {
            "type": "array",
            "minItems": 1,
            "maxItems": 8,
            "items": {
              "type": "string",
              "minLength": 1,
              "maxLength": 80,
              "pattern": "^[a-z][a-z0-9-]{0,79}$"
            },
            "uniqueItems": true
          },
          "title": {
            "type": "string",
            "minLength": 1,
            "maxLength": 160
          },
          "publication": {
            "enum": [
              "published",
              "candidate"
            ]
          },
          "summary": {
            "type": "string",
            "minLength": 1,
            "maxLength": 1200
          },
          "capabilities": {
            "type": "array",
            "minItems": 1,
            "maxItems": 8,
            "items": {
              "type": "object",
              "additionalProperties": false,
              "required": [
                "id",
                "title",
                "environment",
                "description",
                "evidenceIds"
              ],
              "properties": {
                "id": {
                  "type": "string",
                  "minLength": 1,
                  "maxLength": 80,
                  "pattern": "^[a-z][a-z0-9-]{0,79}$"
                },
                "title": {
                  "type": "string",
                  "minLength": 1,
                  "maxLength": 160
                },
                "environment": {
                  "enum": [
                    "browser-local",
                    "node-local",
                    "independent-node-evaluation",
                    "public-mcp",
                    "offline-candidate",
                    "repository-tooling"
                  ]
                },
                "description": {
                  "type": "string",
                  "minLength": 1,
                  "maxLength": 1200
                },
                "evidenceIds": {
                  "type": "array",
                  "minItems": 1,
                  "maxItems": 8,
                  "items": {
                    "type": "string",
                    "minLength": 1,
                    "maxLength": 80,
                    "pattern": "^[a-z][a-z0-9-]{0,79}$"
                  },
                  "uniqueItems": true
                }
              }
            }
          },
          "evidence": {
            "type": "array",
            "minItems": 1,
            "maxItems": 12,
            "items": {
              "type": "object",
              "additionalProperties": false,
              "required": [
                "id",
                "kind",
                "observedAt",
                "description",
                "artifact"
              ],
              "properties": {
                "id": {
                  "type": "string",
                  "minLength": 1,
                  "maxLength": 80,
                  "pattern": "^[a-z][a-z0-9-]{0,79}$"
                },
                "kind": {
                  "enum": [
                    "source",
                    "documentation",
                    "local-test",
                    "synthetic-transaction-test",
                    "independent-node-evaluation",
                    "live-service-check",
                    "upstream-source-check"
                  ]
                },
                "observedAt": {
                  "anyOf": [
                    {
                      "type": "string",
                      "minLength": 1,
                      "maxLength": 24,
                      "pattern": "^\\d{4}-\\d{2}-\\d{2}T\\d{2}:\\d{2}:\\d{2}\\.\\d{3}Z$",
                      "format": "date-time"
                    },
                    {
                      "type": "null"
                    }
                  ]
                },
                "description": {
                  "type": "string",
                  "minLength": 1,
                  "maxLength": 1200
                },
                "artifact": {
                  "type": "object",
                  "additionalProperties": false,
                  "required": [
                    "path",
                    "sha256",
                    "commit",
                    "url"
                  ],
                  "properties": {
                    "path": {
                      "type": "string",
                      "minLength": 1,
                      "maxLength": 240,
                      "pattern": "^(?:[A-Za-z0-9_.-]+/)*[A-Za-z0-9_.-]+$"
                    },
                    "sha256": {
                      "type": "string",
                      "minLength": 1,
                      "maxLength": 64,
                      "pattern": "^[a-f0-9]{64}$"
                    },
                    "commit": {
                      "anyOf": [
                        {
                          "type": "string",
                          "minLength": 1,
                          "maxLength": 40,
                          "pattern": "^[a-f0-9]{40}$"
                        },
                        {
                          "type": "null"
                        }
                      ]
                    },
                    "url": {
                      "anyOf": [
                        {
                          "type": "string",
                          "minLength": 1,
                          "maxLength": 400,
                          "pattern": "^https://github\\.com/BEACNpool/NFT-Studio/blob/[a-f0-9]{40}/(?:[A-Za-z0-9_.-]+/)*[A-Za-z0-9_.-]+$"
                        },
                        {
                          "type": "null"
                        }
                      ]
                    }
                  },
                  "allOf": [
                    {
                      "if": {
                        "properties": {
                          "commit": {
                            "type": "null"
                          }
                        }
                      },
                      "then": {
                        "properties": {
                          "url": {
                            "type": "null"
                          }
                        }
                      },
                      "else": {
                        "properties": {
                          "url": {
                            "type": "string"
                          }
                        }
                      }
                    }
                  ]
                }
              },
              "allOf": [
                {
                  "if": {
                    "properties": {
                      "kind": {
                        "enum": [
                          "independent-node-evaluation",
                          "live-service-check",
                          "upstream-source-check"
                        ]
                      }
                    }
                  },
                  "then": {
                    "properties": {
                      "observedAt": {
                        "type": "string",
                        "minLength": 1,
                        "maxLength": 24,
                        "pattern": "^\\d{4}-\\d{2}-\\d{2}T\\d{2}:\\d{2}:\\d{2}\\.\\d{3}Z$",
                        "format": "date-time"
                      },
                      "artifact": {
                        "properties": {
                          "commit": {
                            "type": "string",
                            "minLength": 1,
                            "maxLength": 40,
                            "pattern": "^[a-f0-9]{40}$"
                          }
                        }
                      }
                    }
                  }
                }
              ]
            }
          },
          "limits": {
            "type": "array",
            "minItems": 1,
            "maxItems": 10,
            "items": {
              "type": "string",
              "minLength": 1,
              "maxLength": 1200
            },
            "uniqueItems": true
          },
          "nextEvidence": {
            "type": "array",
            "minItems": 1,
            "maxItems": 8,
            "items": {
              "type": "string",
              "minLength": 1,
              "maxLength": 1200
            },
            "uniqueItems": true
          }
        },
        "allOf": [
          {
            "if": {
              "properties": {
                "publication": {
                  "const": "published"
                }
              }
            },
            "then": {
              "properties": {
                "evidence": {
                  "items": {
                    "properties": {
                      "artifact": {
                        "properties": {
                          "commit": {
                            "type": "string",
                            "minLength": 1,
                            "maxLength": 40,
                            "pattern": "^[a-f0-9]{40}$"
                          }
                        }
                      }
                    }
                  }
                }
              }
            },
            "else": {
              "properties": {
                "capabilities": {
                  "items": {
                    "properties": {
                      "environment": {
                        "const": "offline-candidate"
                      }
                    }
                  }
                }
              }
            }
          }
        ]
      }
    }
  }
}
