{
  "schemaVersion": 1,
  "kind": "beacn.implementation-register",
  "asOf": "2026-09-07T09:28:28.526Z",
  "repository": "https://github.com/BEACNpool/NFT-Studio",
  "sourceCatalog": {
    "path": "knowledge/catalog.json",
    "sha256": "5dfa23f8a3db42bdf4f2fa9e23536574864df5e9baff3c946232765b6a2cc381"
  },
  "description": "Dated implementation observations, separate from the frozen research catalog and upstream CIP status. Publication describes source availability; capability environment and evidence describe what was actually exercised.",
  "records": [
    {
      "id": "living-artifact",
      "entryIds": [
        "living-artifact",
        "cip-0067",
        "cip-0068"
      ],
      "title": "State Capsules",
      "publication": "published",
      "summary": "A local state-history composer and experimental Plutus lifecycle with separate evidence for issuance and later state changes.",
      "capabilities": [
        {
          "id": "local-history",
          "title": "Compose and verify a local history",
          "environment": "browser-local",
          "description": "Create datum states, advance a hash-linked sequence and export a frozen branch. The browser history has no chain authority.",
          "evidenceIds": [
            "capsule-ui",
            "capsule-codec",
            "capsule-codec-check"
          ]
        },
        {
          "id": "issuance-evaluation",
          "title": "Evaluate one-shot issuance",
          "environment": "independent-node-evaluation",
          "description": "An unsigned pair mint using current public inputs passed independent node script evaluation; missing-signer and reference-only seed variants were rejected.",
          "evidenceIds": [
            "capsule-contract",
            "capsule-node"
          ]
        },
        {
          "id": "synthetic-state-transitions",
          "title": "Exercise evolution and freeze",
          "environment": "node-local",
          "description": "Compiled script wrappers exercised complete synthetic issuance, evolution and freeze transactions. This is local evaluator evidence.",
          "evidenceIds": [
            "capsule-contract",
            "capsule-transactions"
          ]
        },
        {
          "id": "fixed-parameter-application",
          "title": "Fixed contract parameters with Aiken equivalence checks",
          "environment": "node-local",
          "description": "Apply an explicit transaction output reference and 1–28 UTF-8-byte base name to the pinned PlutusV3 capsule blueprint. Locally tested applied scripts and policy identities match Aiken across 256 generated cases and CSL 17 independently; seed existence, unspentness and contract spending are not checked.",
          "evidenceIds": [
            "capsule-parameter-source",
            "capsule-parameter-doc",
            "capsule-parameter-aiken"
          ]
        },
        {
          "id": "contract-parameter-browser",
          "title": "Local browser contract parameter review and export",
          "environment": "browser-local",
          "description": "The Contract compiler Lab accepts the explicit seed/name, clears old output when any input changes, and exports applied blueprint and identity bytes. Local browser evidence covers 256 compiler-oracle cases plus 15 integrated desktop/mobile UI checks. No wallet or transaction is prepared.",
          "evidenceIds": [
            "capsule-parameter-source",
            "capsule-parameter-doc",
            "capsule-parameter-browser",
            "capsule-contract-ui-check"
          ]
        }
      ],
      "evidence": [
        {
          "id": "capsule-ui",
          "kind": "source",
          "observedAt": null,
          "description": "Published browser composer and local verifier.",
          "artifact": {
            "path": "components/state-capsule-lab.tsx",
            "sha256": "bd0613a2ee6eb3d641f2af9e9c703af9dfaca650491f96521ac76a1848004fe9",
            "commit": "d2003bec53b944c7b71bd50caa2a14002008c7ea",
            "url": "https://github.com/BEACNpool/NFT-Studio/blob/d2003bec53b944c7b71bd50caa2a14002008c7ea/components/state-capsule-lab.tsx"
          }
        },
        {
          "id": "capsule-codec",
          "kind": "source",
          "observedAt": null,
          "description": "Shared datum and history codec used by the browser and local tooling.",
          "artifact": {
            "path": "contracts/state-capsule/scripts/capsule-codec.mjs",
            "sha256": "674fa480cdc7dd9cd3eed2324a320a392de16a6339228e66e4834e09fe22207f",
            "commit": "d2003bec53b944c7b71bd50caa2a14002008c7ea",
            "url": "https://github.com/BEACNpool/NFT-Studio/blob/d2003bec53b944c7b71bd50caa2a14002008c7ea/contracts/state-capsule/scripts/capsule-codec.mjs"
          }
        },
        {
          "id": "capsule-contract",
          "kind": "source",
          "observedAt": null,
          "description": "Combined issuance/spending source; its rules require the intended applied script identity.",
          "artifact": {
            "path": "contracts/state-capsule/validators/capsule.ak",
            "sha256": "569b6ecc6a098de9eaaa9a8d0b08aea6953de9c1c5c727263dae36acbcde8b8d",
            "commit": "d2003bec53b944c7b71bd50caa2a14002008c7ea",
            "url": "https://github.com/BEACNpool/NFT-Studio/blob/d2003bec53b944c7b71bd50caa2a14002008c7ea/contracts/state-capsule/validators/capsule.ak"
          }
        },
        {
          "id": "capsule-doc",
          "kind": "documentation",
          "observedAt": null,
          "description": "Lifecycle, irreversible freeze/ADA behavior and scoped readiness.",
          "artifact": {
            "path": "docs/STATE_CAPSULES.md",
            "sha256": "145fb7cc12508b2b059d7a09e7cc11077cde4724fdfc202952c784f8ad9ddf60",
            "commit": "d2003bec53b944c7b71bd50caa2a14002008c7ea",
            "url": "https://github.com/BEACNpool/NFT-Studio/blob/d2003bec53b944c7b71bd50caa2a14002008c7ea/docs/STATE_CAPSULES.md"
          }
        },
        {
          "id": "capsule-codec-check",
          "kind": "local-test",
          "observedAt": null,
          "description": "Receipt: 256 serializer/hash fixtures, 258 history states and 34 rejection cases.",
          "artifact": {
            "path": "contracts/state-capsule/fixtures/codec-verification.json",
            "sha256": "e336cc5a266612b3ceac7d5ad5d02ef470deb612c398643747283858931693d8",
            "commit": "d2003bec53b944c7b71bd50caa2a14002008c7ea",
            "url": "https://github.com/BEACNpool/NFT-Studio/blob/d2003bec53b944c7b71bd50caa2a14002008c7ea/contracts/state-capsule/fixtures/codec-verification.json"
          }
        },
        {
          "id": "capsule-transactions",
          "kind": "synthetic-transaction-test",
          "observedAt": null,
          "description": "Receipt: five complete synthetic signed transactions and compiled wrapper evaluation, with explicit phase-1 and inclusion exclusions.",
          "artifact": {
            "path": "contracts/state-capsule/fixtures/transaction-verification.json",
            "sha256": "350618f0012a7644af1fb1178920b3af1452f17fd8a1a401f45653e49d4180d0",
            "commit": "d2003bec53b944c7b71bd50caa2a14002008c7ea",
            "url": "https://github.com/BEACNpool/NFT-Studio/blob/d2003bec53b944c7b71bd50caa2a14002008c7ea/contracts/state-capsule/fixtures/transaction-verification.json"
          }
        },
        {
          "id": "capsule-node",
          "kind": "independent-node-evaluation",
          "observedAt": "2026-09-07T04:58:11.770Z",
          "description": "Sanitized unsigned issuance evaluation receipt, including two negative cases; no transaction was submitted.",
          "artifact": {
            "path": "contracts/state-capsule/evaluation/public-utxo-node-evaluation.json",
            "sha256": "f5b27a309e3e800cbdaaf9025058bd16005a8f1cb7f86418d8c53c69dcadb913",
            "commit": "d2003bec53b944c7b71bd50caa2a14002008c7ea",
            "url": "https://github.com/BEACNpool/NFT-Studio/blob/d2003bec53b944c7b71bd50caa2a14002008c7ea/contracts/state-capsule/evaluation/public-utxo-node-evaluation.json"
          }
        },
        {
          "id": "capsule-parameter-source",
          "kind": "source",
          "observedAt": null,
          "description": "Fixed-blueprint parameter application using pinned Harmonic UPLC libraries. Accepts one explicit seed reference and an exact UTF-8 base name; returns script bytes, hashes and labeled token names without a wallet or transaction.",
          "artifact": {
            "path": "experiments/capsule-parameterizer/src/index.mjs",
            "sha256": "045d38b4cccdf33d4ae592907db3a090d1b537c7de08ea7d878772ab208549f3",
            "commit": "e87e2b0b27cd88b380e5b2bab2f7c0034ae03857",
            "url": "https://github.com/BEACNpool/NFT-Studio/blob/e87e2b0b27cd88b380e5b2bab2f7c0034ae03857/experiments/capsule-parameterizer/src/index.mjs"
          }
        },
        {
          "id": "capsule-parameter-doc",
          "kind": "documentation",
          "observedAt": null,
          "description": "Parameterizer scope, fixed blueprint/compiler identities, primary application sources, exact UTF-8 and strict input limits, Aiken/CSL comparisons, and explicit absence of a live capsule mint flow.",
          "artifact": {
            "path": "experiments/capsule-parameterizer/README.md",
            "sha256": "4f6f35a625489ef4d6bc67ae79d7fa4762efe9399b6a786d6201684f6645b19e",
            "commit": "e87e2b0b27cd88b380e5b2bab2f7c0034ae03857",
            "url": "https://github.com/BEACNpool/NFT-Studio/blob/e87e2b0b27cd88b380e5b2bab2f7c0034ae03857/experiments/capsule-parameterizer/README.md"
          }
        },
        {
          "id": "capsule-parameter-aiken",
          "kind": "local-test",
          "observedAt": "2026-09-07T06:46:21.290Z",